,dataset_name,cell_type,cell_type_ontology_id,donor_id,sex,race,development_stage,count,percentage
0,HBCA - global,blood vessel endothelial cell,CL:0000071,HBCA_Donor_17,female,unknown,40-year-old human stage,1810,42.92150818117145
1,HBCA - global,endothelial cell of lymphatic vessel,CL:0002138,HBCA_Donor_17,female,unknown,40-year-old human stage,37,0.8774009959686981
2,HBCA - global,myoepithelial cell of mammary gland,CL:0002324,HBCA_Donor_17,female,unknown,40-year-old human stage,44,1.0433957789898032
3,HBCA - global,luminal epithelial cell of mammary gland,CL:0002326,HBCA_Donor_17,female,unknown,40-year-old human stage,481,11.406212947593076
4,HBCA - global,fibroblast of mammary gland,CL:0002555,HBCA_Donor_17,female,unknown,40-year-old human stage,256,6.070666350486128
5,HBCA - global,mural cell,CL:0008034,HBCA_Donor_17,female,unknown,40-year-old human stage,1268,30.0687692672516
6,HBCA - global,progenitor cell of mammary luminal epithelium,CL:0009116,HBCA_Donor_17,female,unknown,40-year-old human stage,321,7.612046478539246
