,dataset_name,cell_type,cell_type_ontology_id,donor_id,sex,race,development_stage,count,percentage
0,HBCA - global,blood vessel endothelial cell,CL:0000071,HBCA_Donor_44,female,unknown,28-year-old human stage,2746,32.76849642004773
1,HBCA - global,B cell,CL:0000236,HBCA_Donor_44,female,unknown,28-year-old human stage,1,0.011933174224343675
2,HBCA - global,"CD8-positive, alpha-beta T cell",CL:0000625,HBCA_Donor_44,female,unknown,28-year-old human stage,1,0.011933174224343675
3,HBCA - global,endothelial cell of lymphatic vessel,CL:0002138,HBCA_Donor_44,female,unknown,28-year-old human stage,9,0.10739856801909309
4,HBCA - global,myoepithelial cell of mammary gland,CL:0002324,HBCA_Donor_44,female,unknown,28-year-old human stage,390,4.6539379474940334
5,HBCA - global,luminal epithelial cell of mammary gland,CL:0002326,HBCA_Donor_44,female,unknown,28-year-old human stage,2295,27.386634844868734
6,HBCA - global,fibroblast of mammary gland,CL:0002555,HBCA_Donor_44,female,unknown,28-year-old human stage,612,7.3031026252983295
7,HBCA - global,mural cell,CL:0008034,HBCA_Donor_44,female,unknown,28-year-old human stage,1957,23.353221957040574
8,HBCA - global,progenitor cell of mammary luminal epithelium,CL:0009116,HBCA_Donor_44,female,unknown,28-year-old human stage,369,4.403341288782816
